{
  "$schema": "http://json-schema.org/draft-07/schema#",
  "title": "COSMIC Tech Document",
  "description": "Technical breakdown artifact migrated from cosmic-claude assets/schemas/tech.json; metadata and the manual-tracking `revised` flag dropped (no manual-editing UX in hanzeep), desiredCfps added as the chain anchor copied from the upstream func artifact.",
  "type": "object",
  "additionalProperties": false,
  "required": ["docType", "language", "index", "desiredCfps", "funcId", "diagrams", "processes"],
  "properties": {
    "docType": { "const": "tech" },
    "language": { "type": "string", "default": "zh-CN" },
    "index": { "type": "integer", "minimum": 1, "description": "1-based position of this function in the upstream plan functions array; must equal the upstream func artifact's index" },
    "desiredCfps": { "type": "integer", "minimum": 1, "description": "CFP budget copied from the upstream func artifact's desiredCfps; the total subprocess count is validated against it" },
    "funcId": { "type": "string", "pattern": "^[A-Z0-9]{1,8}(?:-[A-Z0-9]{1,8})+$" },
    "diagrams": {
      "type": "array",
      "description": "Full mermaid diagram source strings (sequence diagrams of data movements)",
      "minItems": 1,
      "items": { "type": "string", "minLength": 1 }
    },
    "processes": {
      "type": "array",
      "description": "Functional processes refined for data movement; must cover every process of the upstream func artifact by name",
      "minItems": 1,
      "items": {
        "type": "object",
        "additionalProperties": false,
        "required": ["index", "name", "description", "originator", "receiver", "origination_event", "subProcesses"],
        "properties": {
          "index": { "type": "integer", "minimum": 1, "description": "Auto-incremented 1-based process number" },
          "name": { "type": "string", "minLength": 1, "description": "Process name, unique within the document; kept identical to the upstream func process it refines" },
          "description": { "type": "string", "minLength": 10 },
          "originator": { "type": "string", "minLength": 1 },
          "receiver": { "type": "string", "minLength": 1 },
          "origination_event": { "type": "string", "minLength": 10 },
          "subProcesses": {
            "type": "array",
            "description": "Data movements of this process in execution order; 3-4 per process is the healthy range, 1/2 and >6 are rejected",
            "minItems": 1,
            "maxItems": 200,
            "items": {
              "type": "object",
              "additionalProperties": false,
              "required": ["description", "dataMovementType", "dataGroup", "dataProperties", "cfp"],
              "properties": {
                "description": { "type": "string", "minLength": 10, "description": "What data moves in this subprocess" },
                "dataMovementType": { "enum": ["E", "X", "R", "W"], "description": "E=Entry, X=Exit, R=Read, W=Write" },
                "dataGroup": { "type": "string", "minLength": 1, "description": "The data group this movement works on" },
                "dataProperties": {
                  "type": "array",
                  "description": "Data properties carried by this movement (at least 2 recommended)",
                  "minItems": 1,
                  "items": { "type": "string", "minLength": 1 }
                },
                "cfp": { "type": "integer", "const": 1, "description": "COSMIC function points; always 1 per subprocess" }
              }
            }
          }
        }
      }
    }
  }
}
