{
  "docType": "tech",
  "language": "zh-CN",
  "index": 1,
  "desiredCfps": 35,
  "funcId": "USR-FAV",
  "diagrams": [
    "sequenceDiagram\n    autonumber\n    actor u as 注册用户\n    participant fav as 收藏服务\n    participant db as 收藏库\n    u->>fav: E 收藏请求\n    fav->>db: W 收藏记录",
    "sequenceDiagram\n    autonumber\n    actor u as 注册用户\n    participant fav as 收藏服务\n    participant db as 收藏库\n    u->>fav: E 列表请求\n    fav->>db: R 收藏记录\n    fav-->>u: X 收藏列表"
  ],
  "processes": [
    {
      "index": 1,
      "name": "收藏商品",
      "description": "将用户提交的收藏请求落为收藏记录，登记收藏来源。",
      "originator": "注册用户",
      "receiver": "收藏服务",
      "origination_event": "用户在商品详情页点击“收藏”按钮",
      "subProcesses": [
        {
          "description": "用户在商品详情页提交收藏请求，携带用户与商品标识",
          "dataMovementType": "E",
          "dataGroup": "收藏请求",
          "dataProperties": [
            "用户ID",
            "商品ID"
          ],
          "cfp": 1
        },
        {
          "description": "系统将本次收藏写入收藏记录，登记收藏时间与来源渠道",
          "dataMovementType": "W",
          "dataGroup": "收藏记录",
          "dataProperties": [
            "用户ID",
            "商品ID",
            "收藏时间"
          ],
          "cfp": 1
        }
      ]
    },
    {
      "index": 2,
      "name": "取消收藏",
      "description": "根据用户的取消请求更新对应收藏记录。",
      "originator": "注册用户",
      "receiver": "收藏服务",
      "origination_event": "用户在收藏列表中点击“取消收藏”",
      "subProcesses": [
        {
          "description": "用户在收藏列表提交取消收藏请求，指明目标商品",
          "dataMovementType": "E",
          "dataGroup": "取消请求",
          "dataProperties": [
            "用户ID",
            "商品ID"
          ],
          "cfp": 1
        },
        {
          "description": "系统更新收藏记录状态为已取消并登记取消时间",
          "dataMovementType": "W",
          "dataGroup": "收藏记录",
          "dataProperties": [
            "记录状态",
            "取消时间"
          ],
          "cfp": 1
        }
      ]
    },
    {
      "index": 3,
      "name": "查询收藏列表",
      "description": "分页返回用户收藏的商品清单。",
      "originator": "注册用户",
      "receiver": "收藏服务",
      "origination_event": "用户进入个人中心的收藏页",
      "subProcesses": [
        {
          "description": "用户进入收藏页发起列表查询，携带分页参数",
          "dataMovementType": "E",
          "dataGroup": "列表请求",
          "dataProperties": [
            "用户ID",
            "页码"
          ],
          "cfp": 1
        },
        {
          "description": "系统读取用户的收藏记录清单",
          "dataMovementType": "R",
          "dataGroup": "收藏记录",
          "dataProperties": [
            "收藏ID",
            "商品ID",
            "收藏时间"
          ],
          "cfp": 1
        },
        {
          "description": "系统向用户返回分页收藏列表与总数",
          "dataMovementType": "X",
          "dataGroup": "收藏列表",
          "dataProperties": [
            "商品列表",
            "总数"
          ],
          "cfp": 1
        }
      ]
    },
    {
      "index": 4,
      "name": "查看收藏商品详情",
      "description": "从收藏列表进入商品详情展示。",
      "originator": "注册用户",
      "receiver": "商品服务",
      "origination_event": "用户在收藏列表中点击某个商品",
      "subProcesses": [
        {
          "description": "用户在收藏列表点击商品发起详情查看请求",
          "dataMovementType": "E",
          "dataGroup": "详情请求",
          "dataProperties": [
            "用户ID",
            "商品ID"
          ],
          "cfp": 1
        },
        {
          "description": "系统读取商品档案中的名称、价格与图文详情",
          "dataMovementType": "R",
          "dataGroup": "商品档案",
          "dataProperties": [
            "商品名称",
            "价格",
            "图文详情"
          ],
          "cfp": 1
        },
        {
          "description": "系统向用户展示商品详情页数据",
          "dataMovementType": "X",
          "dataGroup": "商品详情",
          "dataProperties": [
            "详情页数据",
            "商品名称"
          ],
          "cfp": 1
        }
      ]
    },
    {
      "index": 5,
      "name": "清理失效收藏",
      "description": "应用户确认批量清理已下架或删除商品的收藏条目。",
      "originator": "注册用户",
      "receiver": "收藏服务",
      "origination_event": "系统提示存在失效收藏条目，用户确认清理",
      "subProcesses": [
        {
          "description": "用户确认清理提示后提交失效条目清单",
          "dataMovementType": "E",
          "dataGroup": "清理请求",
          "dataProperties": [
            "用户ID",
            "失效条目列表"
          ],
          "cfp": 1
        },
        {
          "description": "系统更新失效条目的清理状态并登记时间",
          "dataMovementType": "W",
          "dataGroup": "收藏记录",
          "dataProperties": [
            "条目状态",
            "清理时间"
          ],
          "cfp": 1
        }
      ]
    },
    {
      "index": 6,
      "name": "统计收藏数量",
      "description": "汇总用户有效收藏条目数量，供角标与个人中心展示。",
      "originator": "注册用户",
      "receiver": "收藏服务",
      "origination_event": "用户查看个人中心的收藏总数角标",
      "subProcesses": [
        {
          "description": "用户查看收藏角标时发起数量汇总请求",
          "dataMovementType": "E",
          "dataGroup": "汇总请求",
          "dataProperties": [
            "用户ID",
            "统计周期"
          ],
          "cfp": 1
        },
        {
          "description": "系统读取有效条目与失效条目的数量记录",
          "dataMovementType": "R",
          "dataGroup": "收藏记录",
          "dataProperties": [
            "条目总数",
            "失效条目数"
          ],
          "cfp": 1
        },
        {
          "description": "系统向用户返回收藏总数用于角标展示",
          "dataMovementType": "X",
          "dataGroup": "收藏数量",
          "dataProperties": [
            "总数",
            "角标数据"
          ],
          "cfp": 1
        }
      ]
    },
    {
      "index": 7,
      "name": "判断重复收藏",
      "description": "收藏提交时核对既有记录，避免产生重复收藏条目。",
      "originator": "注册用户",
      "receiver": "收藏服务",
      "origination_event": "用户提交收藏请求，系统核对既有收藏",
      "subProcesses": [
        {
          "description": "用户提交收藏请求时系统接收查重输入",
          "dataMovementType": "E",
          "dataGroup": "收藏请求",
          "dataProperties": [
            "用户ID",
            "商品ID"
          ],
          "cfp": 1
        },
        {
          "description": "系统读取既有收藏记录中的已收藏标记",
          "dataMovementType": "R",
          "dataGroup": "收藏记录",
          "dataProperties": [
            "已收藏标记",
            "收藏时间"
          ],
          "cfp": 1
        },
        {
          "description": "系统返回是否重复的结论与友好提示",
          "dataMovementType": "X",
          "dataGroup": "重复提示",
          "dataProperties": [
            "是否重复",
            "提示信息"
          ],
          "cfp": 1
        }
      ]
    },
    {
      "index": 8,
      "name": "推送收藏降价提醒",
      "description": "收藏商品降价时向收藏用户发出提醒通知。",
      "originator": "价格服务",
      "receiver": "通知服务",
      "origination_event": "商品价格变动事件到达价格服务",
      "subProcesses": [
        {
          "description": "价格服务发出商品价格变动事件通知",
          "dataMovementType": "E",
          "dataGroup": "价格变动",
          "dataProperties": [
            "商品ID",
            "新价格"
          ],
          "cfp": 1
        },
        {
          "description": "系统读取收藏该商品的用户清单",
          "dataMovementType": "R",
          "dataGroup": "收藏记录",
          "dataProperties": [
            "用户ID列表",
            "收藏时间"
          ],
          "cfp": 1
        },
        {
          "description": "系统向收藏用户发出降价通知",
          "dataMovementType": "X",
          "dataGroup": "降价通知",
          "dataProperties": [
            "用户ID",
            "降价信息"
          ],
          "cfp": 1
        }
      ]
    },
    {
      "index": 9,
      "name": "导出收藏清单",
      "description": "将用户收藏清单按所选格式导出为文件供下载。",
      "originator": "注册用户",
      "receiver": "收藏服务",
      "origination_event": "用户在收藏页点击“导出收藏”按钮",
      "subProcesses": [
        {
          "description": "用户提交清单导出请求并选择文件格式",
          "dataMovementType": "E",
          "dataGroup": "导出请求",
          "dataProperties": [
            "用户ID",
            "文件格式"
          ],
          "cfp": 1
        },
        {
          "description": "系统读取用户的收藏记录清单",
          "dataMovementType": "R",
          "dataGroup": "收藏记录",
          "dataProperties": [
            "收藏ID",
            "商品ID"
          ],
          "cfp": 1
        },
        {
          "description": "系统向用户返回生成的导出文件",
          "dataMovementType": "X",
          "dataGroup": "导出文件",
          "dataProperties": [
            "文件内容",
            "导出时间"
          ],
          "cfp": 1
        }
      ]
    },
    {
      "index": 10,
      "name": "新建收藏分组",
      "description": "用户在收藏页创建自定义分组，把收藏条目按主题归类。",
      "originator": "注册用户",
      "receiver": "收藏服务",
      "origination_event": "用户在收藏页点击“新建分组”",
      "subProcesses": [
        {
          "description": "用户提交新建分组请求，携带分组名称",
          "dataMovementType": "E",
          "dataGroup": "分组请求",
          "dataProperties": [
            "用户ID",
            "分组名称"
          ],
          "cfp": 1
        },
        {
          "description": "系统将新分组写入收藏分组记录，登记创建时间",
          "dataMovementType": "W",
          "dataGroup": "收藏分组",
          "dataProperties": [
            "分组ID",
            "创建时间"
          ],
          "cfp": 1
        }
      ]
    },
    {
      "index": 11,
      "name": "导入外部收藏",
      "description": "用户将其他渠道的收藏条目导入本应用，按来源渠道登记。",
      "originator": "注册用户",
      "receiver": "收藏服务",
      "origination_event": "用户在收藏页选择“导入收藏”",
      "subProcesses": [
        {
          "description": "用户选择导入来源并提交导入请求",
          "dataMovementType": "E",
          "dataGroup": "导入请求",
          "dataProperties": [
            "用户ID",
            "来源渠道"
          ],
          "cfp": 1
        },
        {
          "description": "系统将导入的收藏条目写入收藏记录，登记来源",
          "dataMovementType": "W",
          "dataGroup": "收藏记录",
          "dataProperties": [
            "商品ID",
            "来源渠道"
          ],
          "cfp": 1
        }
      ]
    },
    {
      "index": 12,
      "name": "恢复已取消收藏",
      "description": "用户在收藏回收站中恢复误取消的收藏条目。",
      "originator": "注册用户",
      "receiver": "收藏服务",
      "origination_event": "用户在收藏回收站点击“恢复”",
      "subProcesses": [
        {
          "description": "用户在回收站选择已取消条目提交恢复请求",
          "dataMovementType": "E",